{"$schema":"https://json-schema.org/draft/2020-12/schema","$id":"https://prax.local/schemas/learning-receipt/v1","title":"Prax local learning receipt","type":"object","additionalProperties":false,"required":["schema_version","lesson_id","lesson_version","actions","attempts","highest_hint_level","observations","learner_authored","uncertainty","created_at"],"properties":{"schema_version":{"const":"prax.learning-receipt/v1"},"lesson_id":{"type":"string"},"lesson_version":{"type":"string"},"actions":{"type":"array","items":{"type":"string"}},"attempts":{"type":"integer","minimum":0},"highest_hint_level":{"type":"integer","minimum":0},"observations":{"type":"object"},"learner_authored":{"type":"object"},"uncertainty":{"type":"string"},"created_at":{"type":"string"},"transfer":{"type":"object"}}}
