{"schema_version":"prax.learning-receipt/v1","lesson_id":"fixture-lesson","lesson_version":"1.0.0","actions":["next"],"attempts":1,"highest_hint_level":0,"observations":{"result":"ok"},"learner_authored":{"explanation":"I compared the states."},"uncertainty":"unknown","created_at":"2026-08-17T00:00:00Z"}
